OA_Topic,match_with_OA,which_is_better,comment_OA,comment_OG,202_gpt4,Title,AbstractBiofortification of Staple Crops for Human Nutrition,,,,,"Essential Oils in Medicinal Plants || This topic explores various studies on the cultivation and treatment of medicinal plants, focusing on how different factors like irrigation, fertilizers, biofertilizers, and drought stress affect the yield, oil content, and chemical composition of essential oils. Research encompasses experiments on plants like peppermint, sweet basil, German chamomile, marigold, and Thymus vulgaris under varied conditions to enhance essential oil production, crucial for industrial and therapeutic applications.",Analysis of minerals under different water stress levels in Andrographis paniculata (Burm.f.) Wall. Ex Nees,"Medicinal plants have diverse use in the society from medicine to cosmetics to herbal foods with vast potential for their curative medicinal properties. Minerals are essential nutrient for plant metabolism and over all growth of the plants. The overall growth of the plant depends upon the availability of the water. The aim of this study was to determine the mineral content under different water stress levels in Andrographis paniculata. The homogenized leaf samples of controlled plants(Daily watered), treated T2 plants(watering 2nd day), T4 plants(watering on every 4th day), T7 plants(watering on every 7th day) were subjected to overnight HN03 digestion and analyzed for the presence of Copper, Chromium, Iron, Aluminum, Zinc, Manganese and Phosphorous. With increase in water stress, element content deceased with varied fractions. The T2 treated plants, irrigated every second day, could withstand the water stress conditions without affecting minimum mineral content in Andrographis paniculata plants and T2 treatment has been chosen the best option to withstand water stress conditions. Keywords: Andrographis paniculata, water stress, minerals."Plant Biostimulants in Agriculture and Horticulture,,,,,"Biostimulant Use in Water-Stressed Crops || This topic explores the role of biostimulants in enhancing the growth and yield of crops under conditions of water stress, such as drought and deficit irrigation. It includes studies on various biostimulant products (e.g., amino acids, humic acids) and their effects on different crops like lettuce, tomato, and common beans grown in arid or semi-arid regions, aiming to mitigate the adverse impacts of limited water availability on plant development and productivity.",Biostimulants Application Alleviates Water Stress Effects on Yield and Chemical Composition of Greenhouse Green Bean (Phaseolus vulgaris L.),"The increasing scarcity of water demands proper water management practices to ensure crop sustainability. In this study, the effect of drought stress and biostimulants application on the yield and chemical composition of green pods and seeds of common bean (Phaseolus vulgaris L.) was evaluated. For this purpose, four commercially available biostimulant products, namely Nomoren (G), EKOprop (EK), Veramin Ca (V), and Twin-Antistress (TW), were tested under two irrigation regimes: normal irrigation (W+) and water-holding (W-) conditions. The highest increase (20.8%) of pods total yield was observed in EKW+ treatment due to the formation of more pods of bigger size compared to control treatment (CW+). In addition, the highest yield under drought stress conditions was recorded for the GW- treatment (5691 ± 139 kg/ha). Regarding the effects of biostimulants on the protein and ash content of pods, the application of VW+ treatment (first harvest of pods; 201 ± 1 and 79 ± 1 g/kg dw for proteins and ash content, respectively) and GW+ (second harvest of pods; 207.1 ± 0.1 and 68.4 ± 0.5 g/kg dw for proteins and ash content, respectively) showed the best results. For seeds, the application of GW+ treatment resulted in the highest content for fat, protein, and ash content (52.7 ± 0.1, 337 ± 1, 56 ± 1 g/kg dw) and energetic value (5474 ± 3 kcal/kg dw). ?-tocopherol was the main detected tocopherol in pods and seeds, and it was significantly increased by the application of TWW- (first harvest of pods; 6410 ± 40 ?g/kg dw), VW- (second harvest of pods; 3500 ± 20 ?g/kg dw), and VW+ (seeds; 39.8 ± 0.1 g/kg dw) treatments. EKW- treatment resulted in the lowest oxalic acid content for both pod harvests (26.3 ± 0.1 g/kg dw and 22.7 ± 0.2 g/kg dw for the first and second harvest of pods, respectively) when compared with the rest of the treatments where biostimulants were applied, although in all the cases, the oxalic acid content was considerably low. Fructose and sucrose were the main sugars detected in pods and seeds, respectively, while the highest content was recorded for the TWW- (first harvest of pods) and GW- (second harvest of pods and seeds) treatments. The main detected fatty acids in pods and seeds were ?-linolenic, linoleic, and palmitic acid, with a variable effect of the tested treatments being observed. In conclusion, the application of biostimulants could be considered as an eco-friendly and sustainable means to increase the pod yield and the quality of common bean green pods and seeds under normal irrigation conditions. Promising results were also recorded regarding the alleviation of negative effects of drought stress, especially for the application of arbuscular mycorrhizal fungi (AMF; G treatment), which increased the total yield of green pods. Moreover, the nutritional value and chemical composition of pods and seeds was positively affected by biostimulants application, although a product specific effect was recorded depending on the irrigation regime and harvesting time (pods and seeds)."Strigolactone Signaling in Plant Interactions,,,,,"Plant Disease Control & Management || This topic encompasses studies on various plant diseases caused by pathogens such as fungi and bacteria, examining their impact on crops like groundnuts, potatoes, and legumes. It covers the identification, impact, and management of diseases like rot, wilt, and blight, highlighting the use of biocontrol agents like Trichoderma and fungicides. Research also explores the effectiveness of bioagents and plant resistance inducers in reducing disease incidence, contributing to sustainable agricultural practices and reduced pesticide dependency.",Imazapic Herbigation for Egyptian Broomrape (Phelipanche aegyptiaca) Control in Processing Tomatoes—Laboratory and Greenhouse Studies,"Parasitic plants belonging to the Orobanchaceae family include species that cause heavy damage to crops in Mediterranean climate regions. Phelipanche aegyptiaca is the most common of the Orobanchaceae species in Israel inflicting heavy damage to a wide range of broadleaf crops, including processing tomatoes. aegyptiaca is extremely difficult to control due to its minute and vast number of seeds and its underground association with host plant roots. The highly efficient attachment of the parasite haustoria into the host phloem and xylem enables the diversion of water, assimilates and minerals from the host into the parasite. Drip irrigation is the most common method of irrigation in processing tomatoes in Israel, but the delivery of herbicides via drip irrigation systems (herbigation) has not been thoroughly studied. The aim of these studies was to test, under laboratory and greenhouse conditions, the factors involved in the behavior of soil-herbigated imazapic, and the consequential influence of imazapic on P. aegyptiaca and tomato plants. Dose-response Petri dish studies showed that imazapic does not impede P. aegyptiaca seed germination and non-attached seedlings, even at the high rate of 5000 ppb. Imazapic applied to tomato roots inoculated with P. aegyptiaca seeds in a PE bag system revealed that the parasite is killed only after its attachment to the tomato roots, at concentrations as low as 2.5 ppb. Imazapic sorption curves and calculated Kd and Koc values indicated that the herbicide Kd is similar in all soils excluding a two-fold higher coefficient in the Gadash farm soil, while the Koc was similar in all soils except the Eden farm soil, in which it was more than twofold lower. In greenhouse studies, control of P. aegyptiaca was achieved at 2.5 ppb imazapic, but adequate control requires repeated applications due to the 7-day half-life (t1/2) of the herbicide in the soil. Tracking of imazapic in soil and tomato roots revealed that the herbicide accumulates in the tomato host plant roots, but its movement to newly formed roots is limited. The data obtained in the laboratory and greenhouse studies provide invaluable knowledge for devising field imazapic application strategies via drip irrigation systems for efficient and selective broomrape control."Artichoke Nutraceutical and Functional Food Research,,,,,"Wastewater Irrigation Effects || This topic explores the varying impacts of using treated and untreated wastewater for irrigation on soil properties, plant health, and agricultural productivity. It discusses the physiological and morphological responses of different plant species to wastewater irrigation, including the potential accumulation of contaminants in soils and plants. The studies cover assessments of chemical and physical changes in soil, the effectiveness of wastewater treatment methods such as the use of Moringa oleifera seeds, and the implications for regions facing water scarcity. The research spans diverse environments, from arid regions to dense settlements, highlighting the global relevance of wastewater reuse in agriculture.","Effects of the Irrigation with Treated Wastewaters on the Proximate Composition, Mineral, and Polyphenolic Profile of the Globe Artichoke Heads [Cynara cardunculus (L.)]","The present work was carried out to evaluate the effects of irrigation with two different municipal wastewaters (secondary-treated wastewater (SW) and tertiary-treated wastewater (TW)) compared to freshwater (FW) on main qualitative parameters of three different classes of globe artichoke (main, secondary, and processing heads). The experimental trial was conducted in Southern Italy (Apulia region) for two cropping cycles (GS1 and GS2) using ‘Violetto di Provenza’ as cultivar. The artichoke heads were analyzed for proximate composition (dry matter, total sugar, total fat, ash, and total protein), percentage of edible part, mineral profile (sodium, potassium, magnesium, calcium, copper, iron, nickel, zinc, chloride, nitrate, phosphate, and sulphate) and polyphenolic acids content (caffeoylquinic acids and flavones). Both SW and TW treatments caused an increase of the percentage of the edible part, head protein contents, and mineral elements of the main and processing heads. Moreover, SW statistically increased the caffeoylquinic acid derivatives and the trans-ferulic acid content, while both SW and TW the flavones content. Finally, according to the multivariate analysis adopted, in our experimental conditions, the mineral component of the heads, such as chloride, potassium, copper, and zinc content, had a greater weight in the separation of FW, SW, and TW. On the other hand, the polyphenolic 5-O-caffeoylquinic acid, trans-ferulic acid, and 1,5-di-O-caffeoylquinic acid had a greater weight in the separation of the head class groups (main, secondary, and processing). Moreover, the trans-ferulic acid content of the heads was related both to the irrigation water type and to the different head classes."Genomics and Pathogenicity of Plant Pathogenic Bacteria,,,,,"Plant Disease Control & Management || This topic encompasses studies on various plant diseases caused by pathogens such as fungi and bacteria, examining their impact on crops like groundnuts, potatoes, and legumes. It covers the identification, impact, and management of diseases like rot, wilt, and blight, highlighting the use of biocontrol agents like Trichoderma and fungicides. Research also explores the effectiveness of bioagents and plant resistance inducers in reducing disease incidence, contributing to sustainable agricultural practices and reduced pesticide dependency.","Fire blight resistance, irrigation and conducive wet weather improve Erwinia amylovora winter survival in cankers","Erwinia amylovora causes fire blight, a disease responsible for enormous economic losses in the pome fruit-producing areas where it is present. Despite the abundant research on fire blight, information about E. amylovora population dynamics and survival in fire blight cankers and the plant defense responses to this pathogen in the infected bark are limited. In our study, we obtained fire blight cankers in apple, pear, and Asian pear cultivars showing differing resistance to the disease by shoot inoculation with E. We collected cankers from irrigated and non-irrigated trees every 3 months in two independent field experiments and analyzed samples by viability digital PCR. We also assessed the expression of pathogenicity-related ( PR ) genes in the bark of selected apple and Asian pear cultivars. A logistic regression analysis revealed the impact of environmental and host factors on E. amylovora detection rates in cankers. The chances of detecting live E. amylovora cells in cankers increased significantly in those collected from irrigated trees, in July, and/or during an experiment performed in a year with an expected average rainfall when compared to samples from non-irrigated trees, collected in January, and/or during an experiment performed under environmental conditions dominated by drought. We found a positive correlation between the pathogen detection rates in cankers and the host resistance to fire blight that might be explained by lower E. amylovora survival rates in more damaged tissues of susceptible hosts. The genes PR-1, PR-2, PR-5, and PR-8 were induced in the bark surrounding apple and Asian pear fire blight cankers. Our study, involving the analysis of more than 800 canker samples, provides new knowledge about the fire blight disease cycle and lays the foundation for improved fire blight management and eradication strategies in pome fruit orchards."Research on Moringa Oleifera,,,,,"Essential Oils in Medicinal Plants || This topic explores various studies on the cultivation and treatment of medicinal plants, focusing on how different factors like irrigation, fertilizers, biofertilizers, and drought stress affect the yield, oil content, and chemical composition of essential oils. Research encompasses experiments on plants like peppermint, sweet basil, German chamomile, marigold, and Thymus vulgaris under varied conditions to enhance essential oil production, crucial for industrial and therapeutic applications.",The Effect of Moringa oleifera Lam. Leaf Aqueous Extract on Seed Yield and Fibre Quality of Linseed under Water Deficit Stress,"Moringa oleifera leaf extract contains active ingredients with stimulatory effects on natural processes of plants like uptake of nutrients, photosynthesis, biomass production and flowering. Therefore, we conducted field experiments to determine the effects of M. oleifera leaf aqueous extract (MLAE) on growth and fibre quality of three linseed varieties viz. Roshni, BL1 and Chandni under water deficit stress for two years. Water deficit stress was imposed during tillering growth phase (60 days after sowing) by skipping four irrigations, keeping 40% soil field capacity. The MLAE (5%) was applied to leaves once before the start of water deficit stress period and next 15 days after imposition of water deficit stress. Analysis of MLAE showed the presence of natural phenolics (150 mg gallic acid equivalents (GAE)/mL extract) and essential nutrients like Ca, Mg, K, Zn, Mn, and Fe. Positive impact of the MLAE was observed on plant height, tillers production, leaf chlorophyll pigments, phenolics content, sugars content, seed yield and fibre quality of linseed both under non-stress and water deficit stress. Our studies concluded that MLAE can be a probable approach for maintaining normal growth and fibre quality of linseed plants under short supply of water."Genetics and Epidemiology of Plant Pathogens,,,,,"Plant Disease Control & Management || This topic encompasses studies on various plant diseases caused by pathogens such as fungi and bacteria, examining their impact on crops like groundnuts, potatoes, and legumes. It covers the identification, impact, and management of diseases like rot, wilt, and blight, highlighting the use of biocontrol agents like Trichoderma and fungicides. Research also explores the effectiveness of bioagents and plant resistance inducers in reducing disease incidence, contributing to sustainable agricultural practices and reduced pesticide dependency.","Seasonal Prevalence of Species of Binucleate <i>Rhizoctonia</i> Fungi in Growing Medium, Leaf Litter, and Stems of Container-Grown Azalea","Rhizoctonia web blight is an annual problem on container-grown azalea (Rhododendron spp.) in the southern and eastern United States but little is documented about the distribution or persistence of Rhizoctonia spp. in container-grown azalea. Sixty web-blight-damaged azalea plants (‘Gumpo White’) were collected in August 2005 and 2006 and arranged in a completely randomized design on an outdoor irrigation pad. A nylon mesh bag containing 30 necrotic leaves collected from web-blight-damaged ‘Gumpo White’ azalea plants were placed on the surface of the medium under the plant canopy in each container to simulate leaf litter. Ten plants were destructively sampled into eight zones by dividing stems into three zones (lengths of 0 to 2, 4 to 6, and 9 to 15 cm above the medium surface), bagged leaves into one leaf litter zone, and the medium into four zones (three horizontal layers: 1 to 3, 3 to 7, and 7 to 10 cm below the medium surface, with the middle layer further divided by removing the central 7.5-cm-diameter core) in December, February, and May. Only the three stem zones were sampled from 10 plants in early and late June and late July. Of 8,940 total isolations, 3,655 fungi with morphological characteristics of a Rhizoctonia sp. were recovered. Percent recovery differed from the eight zones (P 0.0001) but did not differ between years (P = 0.3950) and sampling times (P = 0.1896). Frequency of recovery of Rhizoctonia spp. was highest from the lower stem and the leaf litter, and decreased with distance from the leaf litter. Recovery from stems over the six sample times was analyzed separately. Percent recovery differed between stem zones (P 0.0001), sample times (P = 0.0478), and experiment years (P 0.0001). In both years, mean recovery of Rhizoctonia spp. was higher from the lower stem and decreased with distance to the upper stem layer. From a subsample of 145 isolates, 95.1% were identified as binucleate Rhizoctonia (BNR) anastomosis groups (AGs)-A, -G, -K, -R, -S, and -U (-P), and 2.8 and 2.1% were Rhizoctonia solani AG-2 and an uncultured Laetisaria sp., respectively. Based on frequency analysis, recovery of BNR AGs differed by plant zone (P 0.0001) but not over sample times (P = 0.4831). The six AGs of BNR are the predominant Rhizoctonia fungi occupying the habitat niches in container-grown azalea, with little change in population frequency and composition from fall to summer; thus, BNR pathogenic and nonpathogenic to azalea have established a mixed Rhizoctonia community on container-grown azalea."Gamma-Aminobutyric Acid Metabolism in Plants,,,,,"Salt Stress on Plant Germination || Studies exploring the effects of salinity on seed germination and early plant growth stages across various species. Focus is on the relative tolerance of plants like Portulaca, lentils, Moringa, melon, quinoa, and others to NaCl and other salinity sources. Methods like osmopriming and surfactant application to enhance stress resilience are discussed, along with the impact on seedling development, germination rates, and plant physiology under different salt concentrations and water qualities.",Effect of salt NaCl stress on seed germination and vegetative growth of Gaillardia (Gaillardia puchella L.),"In order to the influence of Salt NaCl stress on seed germination and vegetative growth of Gillardia, during the successful year 2018, at the Horticultural, Garden Sindh Agriculture University Tandojam Pakistan.The experiment was conducted as factorial Complete randomized design (CRD) with three replication in the Seed of two varieties (Lorenziana double mix and Gaillardia sundance) and salinity levels (0, 1, 3, 5 and 7ds/m).The results showed that cultivar has significant affect on the irrigation water (Control canal irrigated water) growth and development showed that (80.37%) seed germination (6.54) numbers of leaves plant -1, (1064.1)and Seedling vigor index 13.23, and other cultivars.The highest and lowest Salinity levels of shoot length (8.03 g), fresh shoot biomass (15.65 cm), root length cm (10.23), root biomass (0.65 g) and electrolyte leakage of leaf (67.53%)The different between these cultivars were observed.It seems that the Salt stress on seed germination is not properly useful for the assessment of salt and tolerance of Gaillardia."Non-destructive Leaf Area Estimation Methods,,,,,"Foodborne Pathogens in Vegetables || This topic encompasses studies on the microbiological safety of vegetables, focusing on the contamination risks associated with foodborne pathogens. Various documents discuss the detection, prevalence, and public health implications of pathogenic microorganisms in leafy greens and other vegetables. These studies highlight concerns about minimal processing, use of contaminated irrigation water, and the potential for disease transmission through consumption of these foods. The research spans diverse geographic locations, emphasizing the global relevance of ensuring the microbial quality of fresh produce.","ENUMERATION OF MICROBIAL LOAD IN LEAFY VEGETABLES GROWN IN PERIPHERY OF ALLAHABAD DISTRICT, UP, INDIA","Leafy vegetables can become contaminated with microorganisms capable of causing diseases in human being.Leafy vegetables may be exposed to many sources of contamination like contaminated sewage used in watering the fields, where these vegetables are grown.In the present study the samples of fresh leafy vegetables like Soya leaves/Dill (Anethum graveolens L.) and Fenugreek leaves (Trigonella foenumgraecum L.).Spinach (Spinacia oleracea L.) were collected from four places of Allahabad District, namely Phaphamau, Mundera, Naini and Jhunsi area where sewage water was used for irrigating the leafy vegetables.The control site was selected in Naini area, where one vegetable grower was using the fresh ground water for irrigation, but the all the environmental condition was same as other sewage irrigated study sites.Total aerobic bacterial counts, total coliform, yeasts and moulds count were enumerated.Presence/absence of Escherichia coli, Shigella spp., Staphylococcus aureus, and Salmonella spp., in selected leafy vegetables were also identified.Most of the vegetable samples were found to be contaminated.The highest total bacterial count was found in Spinach (8.5 log cfu/gm.)for Naini area and the lowest in Fenugreek leaves (4.27 log cfu/gm.)for Phaphamau area.While the total bacterial counts of the leafy vegetables grown in fresh water were 0.15 log cfu/gm.for soya leaves, 0.2 log cfu/gm.for Fenugreek leaves and 0.19 log cfu/gm.for Spinach.The highest Coliform counts were found in Spinach (4.36 log cfu/gm.)for Mundera area and the lowest in Soya leaves (1.3 log cfu/gm.)for Jhunsi area.While yeast and mould counts were not detected in fresh ground water grown leafy vegetables.The presence of E. coli was identified in Soya leaves and Fenugreek leaves for Naini and Jhunsi area and in spinach for all the study sites whereas it was found to be absent for Phaphamau and Mundera area in Soya leaves and Fenugreek leaves.The presence of Shigella spp. was identified in all leafy vegetables for all the study sites.Salmonella spp.were present in Soya leaves for only Naini and Jhunsi area, in Fenugreek leaves its presence was isolated for all the study sites except Phaphamau but its presence in Spinach was identified for all the study sites.The presence of Staphylococcus aureus was identified"