OA_Topic,match_with_OA,which_is_better,comment_OA,comment_OG,202_gpt4,Title,AbstractAdaptation to Climate Change in Agriculture,,,,,"""Climate Change Adaptation in Agriculture || This topic explores various studies on how climate change impacts agriculture across different regions, including Nepal, Ethiopia, Ghana, Bangladesh, Pakistan, and Zimbabwe. It focuses on farmers' perceptions, adaptation strategies to mitigate adverse effects on crop yields and food security, and the economic implications of climate change on farming communities. The studies assess local practices, socio-economic factors influencing adaptation, and the overall vulnerability of agriculture to changing climate conditions, emphasizing the importance of tailored strategies to sustain agricultural productivity.""","Impact of Climate Change on Crop Production and Potential Adaptive Measures in the Olifants Catchment, South Africa","Climate change is expected to substantially reduce future crop yields in South Africa, thus affecting food security and livelihood. Adaptation strategies need to be implemented to mitigate the effect of climate change-induced yield losses. In this paper, we used the WEAP-MABIA model, driven by six CORDEX climate change data for representative concentration pathways (RCPs) 4.5 and 8.5, to quantify the effect of climate change on several key crops, namely maize, soya beans, dry beans, and sunflower, in the Olifants catchment. The study further investigated climate change adaptation such as the effects of changing planting dates with the application of full irrigation, rainwater harvesting, deficit irrigation method, and the application of efficient irrigation devices on reducing the impact of climate change on crop production. The results show that average monthly temperature is expected to increase by 1 °C to 5 °C while a reduction in precipitation ranging between 2.5% to 58.7% is projected for both RCP 4.5 and RCP 8.5 relative to the baseline climate for 1976–2005, respectively. The results also reveal that increased temperature and decreased precipitation during planting seasons are expected to increase crop water requirements. A steady decline in crop yield ranging between 19–65%, 11–38%, 16–42%, and 5–30% for maize, soya beans, dry beans, and sunflower, respectively, is also projected under both RCPs climate change scenarios. The study concludes that adaptation measures such as the integration of changing planting dates with full irrigation application and the use of rainwater harvest will help improve current and future crop production under the impact of climate change."Factors Affecting Maize Yield and Lodging Resistance,,,,,"Maize Yield and Irrigation || Studies across various global locations investigate the effects of irrigation regimes and nitrogen levels on maize (Zea mays L.) growth, yield, and water-use efficiency. The experiments vary in their design, involving different irrigation percentages, nitrogen dosages, and field capacities, with a focus on optimizing maize productivity through precise water and nitrogen management. The resultant impacts are crucial for food security, agricultural sustainability, and economic viability, especially in areas facing water scarcity and changing climatic conditions.","Maize (Zea mays L.) yield response to the effect of blended fertilizer and varieties under supplemental irrigation at Hadero Zuria Kebele, southern Ethiopia","Maize is one of the staple cereal crops in Ethiopia. However, in southern Ethiopia, the productivity of the crop is very low as compared to the average national productivity, which is mainly attributed to poor soil fertility and the use of low yielding varieties. Hence, a field experiment was conducted at Hadero Zuria kebele, southern Ethiopia under supplemental irrigation to investigate the effects of different rates of blended Nitrogen, Phosphorus, Sulphur, and Boron (NPSB) fertilizer on the performance of maize varieties. Treatments involving three varieties of maize (30G19, BH-546, and BH-547) and six rates of NPSB fertilizer (0, 50, 75, 100, 125, and 150) kg ha?1 were tested in RCBD using a factorial arrangement with three replications. Data on crop Phenological, growth, yield, and yield components were collected. The results showed that the blended NPSB fertilizer rates and varieties of maize affected days to physiological maturity, leaf area, leaf area index, hundred kernels weight (HKW), dry biomass yield (DBY), and grain yield (GY). The highest mean values for HKW, DBY, and GY were obtained from the 150 kg ha?1 NPSB rate. Similarly, the highest values for DBY and GY were obtained from the BH-546 variety. Significant differences (P 0.05) were obtained on days to tasseling, days to silking, and harvest index (HI) due to the interaction effect of NPSB rates and varieties. As the NPSB rates increased from 0 to 150 kg ha?1, HKW and DBY increased consistently from 29.62 to 36.62 g and 31.41 to 43.70 t ha?,1 respectively. Grain yield showed a highly significant and positive correlation with cob length, leaf number, HI, HKW, and DBY. Also, maximized economic profitability was gained at a rate of 150 kg ha?1 NPSB fertilizer. Thus, from this result, the NPSB rate of 150 kg ha?1 with the hybrid maize variety BH-546 could be better for the study area."Water Resource Management and Agricultural Technology,,,,,"""Ancient Hydraulic Engineering || This topic explores the history and sustainability of ancient water management systems across various regions, from Athens' aqueducts and Jerusalem's water supply facilities to the engineering marvels in the Algerian Sahara and beyond. It addresses the construction and function of dams, irrigation systems, and other hydraulic structures that have supported civilizations for centuries. Through examining geological, technical, and socio-economic aspects, the documents reveal how ancient communities overcame environmental challenges to secure water, a critical resource for agriculture, urban development, and survival in arid landscapes.""",Dynamics of the hydraulic and alluvial regime of the lower reaches of the Amudarya after the commissioning of the Takhiatash and Tuyamuyun hydrosystems,"The article presents data on changes in the main hydraulic parameters of the flow in the hydrological sections of the Amudarya river located in the zone of influence of the Takhiatash and Tuyamuyun reservoirs. It has been established that in recent years an acute water shortage has been observed in the lower reaches of the river during the growing season. In dry years for the Amudarya River, the Takhiatash hydroelectric complex becomes the last section, in some periods there are even no sanitary passes through the hydroelectric complex in the prescribed manner, and as a result, a tense situation is created in the Amudarya delta below the Takhiatash hydroelectric complex. Analysis of the hydrological regime of the river showed that in the lower reaches of the Amudarya on the territory of the Kharezm region and Karakalpakstan, the water regime of the river is very different from the domestic one. The low-water period on the river practically begins in September, as there is a large flow of water in September and October. The waters coming from the upper reaches of the river are retained to fill the Tuyamuyun reservoir. At the same time, the end of the low-water period is actually shifted to the beginning of March, since in March, the work of the water accumulated in the reservoir begins and its supply for flushing irrigation begins. The flood waters entering the Tuyamuyun reservoir are either fully accumulated (if the reservoirs are not filled up to the normal retention level of the NRL) or are very strongly transformed (if the reservoir is filled up to the NRL). Analysis of the dynamics of sediment runoff showed that the amplitudes of fluctuations in sediment runoff over periods have a very wide range of changes. In the initial period of operation of the hydroelectric complex, the sediment runoff mode almost repeats the household mode, that is, the largest runoff occurs during the dry season, but with the lowest solid runoff values on average 3 and 8 (at the Samanbai station) times. For 7 years from 1975 to 1981, the annual flow at the Kipchak gauging station amounted to 41.722 thousand tons, that is, 32% of the annual household regime. The largest annual flow at the Kipchak and Samanbai gauging stations took place in the high-water year 1978 and amounted to 66329 and 57971 thousand tons ??????????????. The smallest amount of annual runoff at gauging stations was observed in dry 1981 and amounted to 25074 and 3943 thousand tons. The study of the sediment runoff regime of the Amudarya river during the period of joint operation of the Takhiatash and Tyuyamuyun hydrosystems showed that the amount of solid runoff entering the zone of influence of the Takhiatash hydroelectric complex significantly decreased due to a sharp decrease in water discharge under the influence of regulation and low water. At the same time, as the analysis of field studies has shown, despite their relatively small number, accumulation of sediments is observed in the pays of the hydroelectric complex, that is, silting occurs. The amount of sediment siltation in the area of the Takhiatash hydroelectric complex varies depending on the water content of the year and the operating mode of the Takhiatash hydroelectric complex. Analysis of the alluvial regime shows that during the period of operation of the hydroelectric complex, depending on the hydrological regime of the river and the regime of the water level in front of the dam, the clarification of the flow occurs in April, May, June and August. The seasonally average clarification of the flow within the upper pool ranges from 10 to 40%, and in some months, at levels close to the NSP, reaches 90%, that is, the upper pool of the node turns into a kind of settling tank. The composition of suspended sediments of the Amudarya varies both in time and along the length of the river, but particles smaller than 0.25 mm remain predominant. Particles larger than 0.25 mm are found only in the upper areas and in an amount of no more than 3 - 4%. During the flood period, along the entire length of the river, the percentage of fines content increases in comparison with the low-water period."Global Burden of Foodborne Pathogens,,,,,"""Salmonella Isolation and Resistance || This topic encompasses research on the isolation, prevalence, and antimicrobial resistance of Salmonella strains from various sources including water, vegetables, and animal feces. Studies focus on diverse geographical locations, with a notable emphasis on Burkina Faso, jotting down the significance of water as a transmission medium for this pathogen. The investigations elaborate on testing methods, serotyping, and the genetic characterization of isolated Salmonella spp., aiming to highlight the public health implications linked to the bacterium's presence in food and water supplies, as well as its resistance patterns to commonly used antibiotics.""","Campylobacteriosis Outbreak Associated with Contaminated Municipal Water Supply — Nebraska, 2017","In March 2017, the Nebraska Department of Health and Human Services (NDHHS) and the Southwest Nebraska Public Health Department were notified of an apparent cluster of Campylobacter jejuni infections in city A and initiated an investigation. Overall, 39 cases were investigated, including six confirmed and 33 probable. Untreated, unboiled city A tap water (i.e., well water) was the only exposure significantly associated with illness (odds ratio [OR] = 7.84; 95% confidence interval [CI] = 1.69-36.36). City A is served by four untreated wells and an interconnected distribution system. Onsite investigations identified that a center pivot irrigation system intended to pump livestock wastewater from a nearby concentrated animal feeding operation onto adjacent farmland had malfunctioned, allowing excessive runoff to collect in a road ditch near two wells that supplied water to the city. These wells were promptly removed from service, after which no subsequent cases occurred. This coordinated response rapidly identified an important risk to city A's municipal water supply and provided the evidence needed to decommission the affected wells, with plans to build a new well to safely serve this community."Agricultural Innovation and Livelihood Diversification,,,,,"""Irrigation Technology Adoption || This topic revolves around the study and assessment of small-scale and micro irrigation technology adoption by farmers across various regions. It explores the socio-economic impacts, behavioral factors, and constraints influencing farmers' decisions to adopt these technologies. The research aims to understand how adoption can enhance agricultural productivity, improve food security, and contribute to sustainable development. Studies cover diverse geographical areas, including Rwanda, South Africa, the North China Plain, Assam in India, Indonesia, Zimbabwe, and districts within Shandong, Hebei, and Henan provinces, focusing on factors like water management, crop yield improvement, and poverty reduction among smallholder farmers.""",Adoption of organic pepper production practices among smallholder farmers in Rwanda- A case study of Bugesera district.,"Bugesera is among the district located in Eastern Province of Rwanda where drought is a limiting factor for agriculture.Innovation and adoption of new technologies in agriculture is one of the keys that should reduce poverty in that area.The general objective of this study was to assess the level of the adoption of organic peppers production practices among smallholder farmers in Rwanda.A case study of Bugesera district.This study employed a cross-sectional survey design and a multi-stage sampling technique to select a sample of 150 respondents was used.The findings of logit regression analysis indicated that four factors such as education level, land size, farming experience, gender and enhanced soil fertility had positive and significant influence on adoption of organic pepper production practices.The demand for organic products creates new export opportunities.The market returns from organic agriculture can potentially contribute to local food security by increasing family incomes.The findings showed that the most common constraints to adoption of organic pepper production practices were lack of stable irrigation system, lack stable and reliable market, unreliable climate, high cost of inputs, lack of extension services, and inadequate capital respectively.Based on these findings, it was recommended that provision of training and technical advice on organic farming practices through agricultural extension services and developing information networks among farmers is vital, input subsidy, harvest(yield) insurance, financial inclusion (accessing affordable loans) is more crucial for stallholder farmers.Government should made effort in stable and durable irrigation systems, improvement of extension services through field visits and more effort in marketing of cash crops especially vegetables because are more perishable."Sustainable Agricultural Development and Resource Management,,,,,"Sustainable Irrigation Practices || This topic encompasses the challenges and solutions related to sustainable water management in irrigation, focusing on the balance between agricultural development and natural resource conservation. It highlights issues such as water scarcity, the impact of climate change, and the importance of efficient water use and management strategies in both developed and developing countries. The role of technological and policy interventions in enhancing water use productivity and sustainability in irrigation systems is also emphasized.",Necessity of Irrigated and Rainfed Agriculture in the World,"The results show that 54% of the world is suitable for rainfed agriculture whereas 80% of agricultural production is form rainfed areas. Therefore, increasing irrigated agriculture is necessary. But, why tendency to irrigation is low? In many areas of the world, water resources are limited and irrigation is not economical. In pressurized irrigation, although irrigation efficiency is high but amount of required water is lower than surface irrigation but cost of pressurized method is very high. Agricultural integration is an affordable approach. Moreover, increasing irrigation efficiency led to use of surface irrigation in small farms. However, selection of an appropriate method for irrigation is more important than other mentioned cases. In some conditions, deficit irrigation is sufficient to achieve to maximum of production. In other conditions, notifying to all effective factors (to choose irrigation system) include compatibility, economics, topographical characteristics, soils, water supply, crops, social influences, external influences and awareness of advantages and disadvantages of different irrigation systems (Table 1) led to maximizing efficiency and finally increasing tendency to irrigated agriculture."Formation and Health Effects of Acrylamide in Food,,,,,"""Sugar Beet Cultivation & Efficiency || This topic encompasses research on the cultivation of sugar beet (Beta vulgaris), focusing on strategies to increase its yield, sugar content, and water use efficiency under various stress conditions like water scarcity and soil salinity. Documents cover the effects of irrigation methods, nitrogen and bio-fertilization levels, and the use of foliar applications on the crop's performance across different geographical regions and growing seasons. It aims at improving sugar beet's sucrose yield and overall agricultural sustainability through optimized input use and resistance to environmental stresses.""","Effects of irrigation and nitrogen on chlorophyll content, dry matter and nitrogen accumulation in sugar beet (Beta vulgaris L.)","A two-year field experiment was conducted to analyze the growth conditions, physical features, yield, and nitrogen use efficiency (NUE) of sugar-beet under limited irrigation conditions in northeast of China. A cultivar H003 was used as plant materials; six treatments (C1-C6) were included: C1, no nitrogen applied, rain-fed; C2, 120.00 kg nitrogen hm ? 2 , rain-fed; C3, no nitrogen applied, hole irrigation for seeding; C4, 120.00 kg nitrogen hm ? 2 , hole irrigation for seeding; C5, no nitrogen applied, hole irrigation for seeding; and C6, 120.00 kg nitrogen hm ? 2 , hole irrigation for seeding, and irrigation at foliage rapid growth stage. The irrigation supply was only 500 mL/plant once. Results showed C6 showed the highest chlorophyll content, dry matter accumulation, yield, etc. and had the best NUE among all the treatments. In conclusion, under the routine fertilization conditions of northeast of China, the cultivation measure of hole irrigation 500 mL/plant for seeding combined with irrigation 500 mL/plant at foliage rapid growth stage greatly improved sugar-beet yield and NUE."Insect-Plant Interactions in Agricultural Ecosystems,,,,,"Aphid Control Insecticide Research || Studies across various locations, primarily at the Washington State University, Irrigated Agriculture Research and Extension Center in Prosser, WA, as well as in Idaho and Mississippi, examine the efficacy of different insecticides against aphids in cotton and wheat. These investigations utilize specific planting and application techniques, such as furrow-irrigation for wheat and high clearance spray tractors for cotton, to evaluate insecticide performance in controlling aphid populations and protecting crop yield.","Control of Banks Grass Mite in Winter Wheat, 1996","Four insecticides were applied to irrigated winter wheat in Fruita, CO. ; on 19 Apr with a CO2-powered sprayer calibrated to apply 17.4 gpa through six LF4 nozzles mounted on a10-ft boom. Plots were 10 ft X 25 ft, arranged in a RCB design with four replications. Plots were sampled on 19 Apr (PRE), 29 Apr (10 DAT), 6 May (17 DAT), and 24 May (35 DAT). On the first three sampling dates, a 4-inch2 section of wheat was cut at ground level and removed from the field in a paper bag. Each sample was weighed before being placed in a Berlese funnel for 24 h to extract mites. Mites were counted under a dissecting microscope, and the number divided by the sample weight to get a BGM/g value which was used for statistical analysis. On the final sampling date (35 DAT), 25 random tillers were picked from each plot, and placed in Berlese funnels for 24 h to extract mites. The number of BGM/tiller was used for statistical analysis. The plots were harvested on 23 Jul using a modified Gleaner L combine with on board scales. Test weight was measured from a sub sample of the grain harvested from each plot."Agroecology and Global Food Systems,,,,,"""Indian Agriculture and Economy || This topic delves into the profound interconnection between agriculture and economic growth in India. It explores the role of subsidies, investments, and technological advancements such as the Green Revolution in enhancing agricultural productivity. Infrastructure development, including irrigation and rural facilities, is highlighted for its crucial support to the sector. The discussion encapsulates agriculture's significant contribution to GDP, employment, and poverty reduction, along with the challenges and disparities within different Indian states. The impact of economic reforms and the importance of agricultural labor are also examined within the context of India's changing agricultural landscape.""",The Office du Niger: an Agropole project for food security in Mali?,"In many African countries, food security is now more valued by agricultural policies than ever before. Since WAEMU (West African Economic and Monetary Union) regards the irrigated area of the Niger Office in Mali as the “rice bowl” of West Africa, this agricultural area has thus become at the heart of regional economy and politics. In this context, agricultural development programs are multiplying, leading to the “new green revolution” supported by international organizations, donors and a number of foundations. These development projects are usually managed by foreign private investors and benefit from large-scale land allocation. This model of agricultural and commercial development has been criticized as a form of land and water grabbing. It raises questions with regards to its role in securing the population’s food supply and the future of small family farms. The role of small farming in food security was recently reaffirmed during the “International Year of Family Farming” (2014)."Intercropping in Agricultural Systems,,,,,"Weed Management in Agriculture || Studies across various locations and years focus on the effectiveness of different weed control methods in crops. These include the use of chemical herbicides, pre-emergence applications, and alternative weed management practices. The research spans across crops like wheat, cotton, blackgram, soybean, maize, pigeonpea, and jute, emphasizing the importance of timely and suitable weed control measures to improve yield and crop health under various agricultural ecosystems.",Alternatives for sustainable weed control in single? and double?cropped soybean: A case study for Mediterranean irrigated conditions,"The irrigated cropping systems in South Europe could benefit from soybean [ Glycine max (L.) Merr.] introduction in their maize ( Zea mays L.)?based crop rotations. However, sustainable weed management strategies are needed for soybean growers under Mediterranean irrigated conditions. This work aimed to assess the weed control efficacy, and the soybean performance, of alternative management practices for single? and double?cropped soybean. Two field experiments were carried out in northeast Spain in the period 2019–2021. Row width narrowing (75–37.5 cm), herbicide application (yes/no), and roller?crimped rye [ Secale cereal (L.) M.Bieb.] cover crop (yes/no) were assessed in the single cropping system experiment (SCS). In the barley?soybean double cropping system experiment (DCS), row width narrowing and herbicide application were assessed. In the SCS, the presence of rye cover crop reduced weed biomass up to 92% compared to the controls without herbicide and cover crop in 2020. In 2021, no effect of the cover crop on weed pressure was found due to the low amount of rye biomass accumulated (11.8 and 3.4 ton DM ha ?1 in 2020 and 2021, respectively). In the DCS, herbicide application attained the expected weed control. Row width narrowing to 37.5 cm did not have an impact on weed pressure nor on soybean yield in either experiment. We concluded that herbicide reduction for single?cropped soybean under Mediterranean irrigated conditions can be achieved by roller?crimping a rye cover crop, provided enough rye biomass is accumulated. In the DCS, our results indicated that further research is needed to find alternatives to chemical weed control."