OA_Topic,match_with_OA,which_is_better,comment_OA,comment_OG,202_gpt4,Title,AbstractPlant Nutrient Uptake and Signaling Pathways,,,,,"Tomato Irrigation & Cultivation Techniques || This topic covers extensive research on the effects of various irrigation techniques, water quality, and fertigation practices on the growth, yield, and quality of tomato plants (Lycopersicon esculentum). It includes studies on drip irrigation, deficit irrigation, the impact of irrigation salinity, and the management of water resources under different environmental conditions. Experiments conducted across multiple locations and years focus on optimizing tomato production through efficient water and nutrient use, highlighting strategies to enhance tomato yield and quality while addressing challenges like blossom-end rot through appropriate calcium fertilization and irrigation management.",Phosphorus (P) improves industrial tomato quality and yield in soil with high phosphorus content,"Soils under intensive and successive cropping with central pivot irrigation tend to present high nutrient contents, especially phosphorus (P), which is a nutrient with a great impact on the yield and quality of agricultural products. Among the rotating crops, the application of high P rates is common in processing tomato, although not supported by research. This work evaluates the effect of phosphate fertilization (0, 200, 400, 600, 800, and 1000 kg ha-1 P2O5) on the yield and quality of industrial tomato ‘Heinz 9553’ grown in a soil with high available P content (145 mg dm-3) resulting of an intensive vegetables cultivation, which have high demand by P. The highest total (127.4 t ha-1) and commercial (108.6 t ha-1) yields were obtained with 413.9 and 384 kg ha-1 P2O5, respectively. The results showed that pH of tomato juice, the percentages of green, red, and commercial fruits were not influenced by the applied P rates. However, nutrient delivery increased the soluble solids content up to 356 kg ha-1 P2O5, which is interesting for tomato processing. After harvesting the fruits, the available soil P content was increased with P supply to the plants. For improvement of commercial yield and soluble solids characteristics, the tomato crop shall be fertilised with P even though the soil has high P content."Genetics and Cultivation of Bananas,,,,,"Plant Disease Control & Management || This topic encompasses studies on various plant diseases caused by pathogens such as fungi and bacteria, examining their impact on crops like groundnuts, potatoes, and legumes. It covers the identification, impact, and management of diseases like rot, wilt, and blight, highlighting the use of biocontrol agents like Trichoderma and fungicides. Research also explores the effectiveness of bioagents and plant resistance inducers in reducing disease incidence, contributing to sustainable agricultural practices and reduced pesticide dependency.",In vitro Evaluation and Sensitivity of Antibiotics and Fungicides against Xanthomonas axonopodis pv. punicae,"Cultivation of high yielding varieties of pomegranate with intensive care and management in the recent past under irrigated condition with early stage exploitation of plants has lead to certain severe pest and disease problems. Bacterial blight disease of pomegranate caused by Xanthomonas axonopodis pv. punicae is one of the most destructive disease of pomegranate (Punica granatum) inflicting considerable quantitative and qualitative losses. Mostly the disease occurred on leaves, stems and fruits. Extensive agricultural practices along with large amount of pesticide as well as antibiotic are required to control this disease. The antibiotic sensitivity against eight isolates was studied by paper disk inhibition method. Streptomycine sulphate (250ppm) + COC (2500ppm) was significantly superior than all the treatments showing maximum inhibition zone in all eight isolates of Xanthomonas axonopodis pv"Genetic and Environmental Factors in Berry Production,,,,,"Strawberry Cultivation & Quality || This topic encompasses studies focused on strawberry cultivation methods, including irrigation, fertigation, LED illumination, and the use of biofertilizers like green algae and antitranspirants. Research spans various geographic locations, including the Mediterranean region of Turkey, Korea, Italy, Jordan, and Punjab, India. It touches on the impact of these cultivation practices on fruit yield, quality characteristics like soluble solid content, firmness, and nutrient status, as well as responses to environmental stresses such as salt stress. Additional discussions include the comparison between different growing media and irrigation intervals on strawberry growth and fruit characteristics.",Use of Liquid Foam to Prevent Freeze Injury tO Strawberry Blossoms,"Freezing air temperatures occurring during strawberry blossom time frequently result in complete or partial crop failure. In Indiana there is nearly a 50% probability that such temperatures will occur during the strawberry bloom period. The current practices of using a straw mulch or sprinkler irrigation to prevent blossom freezing are limited by unavailability of material or labor, excessive expense, and frequent failure to provide adequate crop protection."Symbiotic Nitrogen Fixation in Legumes,,,,,"Rhizobium Inoculation and Legume Performance || This topic covers research on the impact of rhizobium and other beneficial bacteria on the growth, nodulation, and productivity of leguminous crops including beans, cowpea, common bean, faba bean, chickpea, soybean, alfalfa, and peanut. Studies focus on the effects of inoculating crops with strains of rhizobium, mycorrhiza, and other inoculants aimed at fixing nitrogen, enhancing nodulation, improving yield and quality under various environmental conditions, and assessing the economic viability of these biotechnological interventions.",Co-inoculation with Azospirillum brasilense in soybean cultivars subjected to water déficit,"This study aimed to verify the effect of co-inoculation, association between Azospirillum brasilense and Bradyrhizobium japonicum bacteria, on soybean plants subjected to water deficit at two sowing dates. Two field experiments were conducted at the Universidade Federal de Tocantins, campus of Palmas, Brazil, in 2016. The experimental design was randomized blocks in a split-split-plot arrangement with four repetitions, where the plots consisted of two irrigation depths (100 and 25% of crop evapotranspiration - ETc), the subplots was composed of two methods of inoculant application (inoculation with Bradyrhizobium japonicum and co-inoculation with Azospirillum brasilense + Bradyrhizobium japonicum) and the sub-subplots comprised two soybean cultivars (TMG 132 and ANTA 82). The cultivars responded differently to the sowing dates. Co-inoculation did not influence grain yield under full irrigation conditions (100% ETc), in neither cultivar evaluated. However, under the water deficit condition (25% ETc), the grain yield of the cultivar TMG 132 increased 77.20%, indicating that there are different responses of interaction between Azospirillum brasilense, plant genotype and sowing dates."Impacts of Elevated CO2 and Ozone on Plant Physiology,,,,,"""Climate Change Adaptation in Agriculture || This topic explores various studies on how climate change impacts agriculture across different regions, including Nepal, Ethiopia, Ghana, Bangladesh, Pakistan, and Zimbabwe. It focuses on farmers' perceptions, adaptation strategies to mitigate adverse effects on crop yields and food security, and the economic implications of climate change on farming communities. The studies assess local practices, socio-economic factors influencing adaptation, and the overall vulnerability of agriculture to changing climate conditions, emphasizing the importance of tailored strategies to sustain agricultural productivity.""","Impact of elevated carbon dioxide and temperature on wheat production under sub temperate climate in north western Himalayas, India","Wheat is the second most important cereal crop and plays a key role in food and nutritional security. The study examines the impact of elevated carbon dioxide and temperature under limited irrigations on wheat crop using crop growth simulation models under sub temperate climate. The Info Crop model was validated using the historical data generated by the research trials of All India Coordinated Research Improvement Project at Palampur, Himachal Pradesh. The model was run for 20 years from 1991 to 2010 for Palampur weather station. The results revealed 3.6 to 4.0 percent and 1.7 to 7.5 percent increase in simulated crop yield with 420 and 470 ppm CO2 respectively. The elevated maximum and minimum temperature by 1 and 20C with 370 ppm carbon dioxide reduced the anthesis period by 5-7 and 9-11 days respectively over the sowing window of November 15th to December 30th. Similarly, days to maturity also reduced by 4-5 and 7-8 days with 1 and 20C rise in temperature respectively. The simulated crop yield showed increase by 17.9 to 63.0 and 33.2 to 133.4 percent with 1 and 20C rise in temperature at 370 ppm CO2 under limited irrigations. The simulated grain yield at 420 ppm CO2 showed an increase of 23 to 69.7 percent with 10C and 39.5 to 123.5 percent with 20C whereas at 470 ppm CO2 level the increase was 27.9 to 76.1 at 10C and 46.4 to 133.0 percent with 20C rise in maximum and minimum temperatures respectively. Hence, simulated results of elevated temperature and CO2 levels proved to be beneficial in rabi wheat with adaptations strategy of limited irrigations under sub temperate climate of North Western Himalayas"Genetic Diversity and Improvement of Soybean,,,,,"Soybean Water Stress Management || This topic explores diverse strategies and research findings on managing water stress in soybean cultivation, addressing the impacts of climatic changes on yield and quality. Studies include field experiments on irrigation regimes, the effects of mineral and alternative fertilizations, and genotype evaluations under varied water conditions. Emphasis is given to improving resilience and productivity of soybean (Glycine max L. Merr.) through innovative agricultural practices, aiming to sustain its vital role as a source of proteins and oils under changing environmental stressors.",Effects of Irrigation and Planting Geometry on Soybean (Glycine max L.) Seed Nutrition in Humid Climates,"This study investigates the effect of irrigation (FI, all rows-irrigation; HI, alternate row irrigation; RF, rainfed) and planting geometry (PG) (SR, single-row; TR, twin-row) on soybean seed constituents. Results showed that most of these seed components were significantly affected by crop season due to contrasting precipitation and solar radiation patterns, particularly during July-August, coinciding with early reproductive and seed development stages. Both seed protein and oil levels responded positively to irrigation, while most of the amino acids were nonresponsive. The protein content ranged between 36.3 and 37.6% in 2018, while it was between 36.4 and 38.3% in 2019. Among amino acids, glycine, alanine, valine, and methionine levels were significantly higher in both FI and HI treatments. Among sugars, only sucrose was higher in response to the RF treatment, and irrigation did not affect both stachyose and raffinose. Oleic acid was higher in RF, while no significant differences were observed for linolenic and linoleic acids. Similarly, seasonal variation was significant for stearic acid content, but the 2019 season had relatively higher accumulation (stearic acid: between 4.1 and 4.5% in 2018 and from 4.6 to 4.9% in 2019). These results indicate that both irrigation and climate during seed development can alter some seed composition constituents and play critical roles in determining seed nutritional qualities."Safflower and Sunflower Cultivation and Utilization,,,,,"Sunflower and Safflower Cultivation || This topic encompasses studies and experiments focused on the cultivation of sunflower (Helianthus annuus) and safflower, examining various aspects such as irrigation, nitrogen management, drought stress, and the application of hormones to improve seed yield and oil content. Research is conducted across different geographical locations, including experimental farms and universities, to identify the best agricultural practices and genotypes for enhancing crop productivity under both irrigated and rainfed conditions.",Quantitative and Qualitative Traits of Sunflower Genotypes as Influenced by Nitrogen Application through Fertigation,"P akistan is facing acute shortage of edible oil.The demand for edible oil in Pakistan is increasing with the uncontrollable increase in population.Its indigenous production is below the consumption levels with a very wide gap between production and consumption.This gap is bridged through import of edible oil worth more than Rs.45.0 billion annually.Pakistan ranks 3 rd largest edible oil importing country in the world (GoP, 2020).The country's oil requirement was about 2.966 million tons in which 0.83 million tons (28%) were locally produced and the rest edible oil was imported.The edible oil requirements have increased from 0.3 million tons to 1.95 million tons.But the domestic production of edible oil has remained inadequate and fluctuating for the last couple of decades.These fluctuations are due to indigenous marketing, low support price and high cost of production which is making these crops non-profitable to Abstract | Fertigation is the application of dissolved fertilizer especially nitrogen through irrigation for correcting nutrient deficiencies of plants.A field study was conducted in Tandojam for two consecutive years in autumn 2018 and 2019.The experiment was replicated thrice in randomized complete block design.Different doses of nitrogen as broadcasting and fertigation (0, 75, 100, 125 kg N ha -1 in two and three equal splits given at sowing time, 1 st , 2 nd and 3 rd irrigations, respectively) were applied to two sunflower genotypes (HO-1 and Hysun-39).Data analysis revealed nitrogen fertigation, genotypes and their interaction substantially (P≤0.05)affected growth and yield traits of sunflower.Greater seed yield (kg ha -1 ) and the oil content (%) were documented in N 10 = 125 kg N ha -1 : three splits (? broadcasting at sowing time + fertigation-? at 1 st and ? at 3 rd irrigation), followed by N 8 = 125 kg N ha -1 : two splits (? broadcasting at sowing time + ? as fertigation at 2 nd irrigation).In between genotypes, higher seed yield (kg ha -1 ) and oil content (%) were recorded in HO-1 as compared to Hysun-39.As regards interactions, enhanced seed yield (kg ha -1 ) and oil content (%) were registered in the interaction of N 10 = 125 kg N ha -1 : three splits (? broadcast at sowing time + fertigation-? at 1 st and ? at 3 rd irrigation) ? HO-1.It was concluded from the results that nitrogen dose should be divided into three splits and applied at sowing time through broadcasting and fertigated at 1 st and 2 nd irrigation, respectively."Molecular Mechanisms of Plant Development and Regulation,,,,,"Gene Expression & Stress Tolerance || This topic explores the molecular mechanisms behind plant responses to various abiotic stresses, including drought, salinity, and cold. It focuses on the role of gene expression, abscisic acid (ABA) signaling, and the identification of differentially expressed genes and mechanisms that confer drought tolerance. Studies examine transgenic plants, natural genetic variation, and the impact of external factors like soil salinity and microbial interactions on gene expression patterns, highlighting advances in understanding and improving plant stress tolerance.",Transcripts and MicroRNAs Responding to Salt Stress in Musa acuminata Colla (AAA Group) cv. Berangan Roots,"Physiological responses to stress are controlled by expression of a large number of genes, many of which are regulated by microRNAs. Since most banana cultivars are salt-sensitive, improved understanding of genetic regulation of salt induced stress responses in banana can support future crop management and improvement in the face of increasing soil salinity related to irrigation and climate change. In this study we focused on determining miRNA and their targets that respond to NaCl exposure and used transcriptome sequencing of RNA and small RNA from control and NaCl-treated banana roots to assemble a cultivar-specific reference transcriptome and identify orthologous and Musa-specific miRNA responding to salinity. We observed that, banana roots responded to salinity stress with changes in expression for a large number of genes (9.5% of 31,390 expressed unigenes) and reduction in levels of many miRNA, including several novel miRNA and banana-specific miRNA-target pairs. Banana roots expressed a unique set of orthologous and Musa-specific miRNAs of which 59 respond to salt stress in a dose-dependent manner. Gene expression patterns of miRNA compared with those of their predicted mRNA targets indicated that a majority of the differentially expressed miRNAs were down-regulated in response to increased salinity, allowing increased expression of targets involved in diverse biological processes including stress signaling, stress defence, transport, cellular homeostasis, metabolism and other stress-related functions. This study may contribute to the understanding of gene regulation and abiotic stress response of roots and the high-throughput sequencing data sets generated may serve as important resources related to salt tolerance traits for functional genomic studies and genetic improvement in banana."Genetic and Agricultural Studies of Sugarcane,,,,,"""Sugar Beet Cultivation & Efficiency || This topic encompasses research on the cultivation of sugar beet (Beta vulgaris), focusing on strategies to increase its yield, sugar content, and water use efficiency under various stress conditions like water scarcity and soil salinity. Documents cover the effects of irrigation methods, nitrogen and bio-fertilization levels, and the use of foliar applications on the crop's performance across different geographical regions and growing seasons. It aims at improving sugar beet's sucrose yield and overall agricultural sustainability through optimized input use and resistance to environmental stresses.""",Root and Sucrose Yields of Sugarbeets as Affected by Mid- to Late-Season Water Stress,"Investigations of the irrigation water requirement of sugarbeets(Beta vulgaris L.) in Arizona and California have shownthat water stress several weeks before harvest of fall-planted beetsreduces root yields but increases sucrose concentration (2,3).Their studies showed that, since soil and plant water stress latein the season did not significantly reduce sucrose production,irrigations could be discontinued 3 to 4 weeks before harvest formaximum water economy. Mid- to late-season water deficit studieson spring-planted sugarbeets at this Center in 1977 and 1978clearly showed that sucrose yield was reduced very little in thisarea, if at all, if irrigations were discontinued after the soilprofile was filled with water about 1 August or 10 to 12 weeksbefore harvest, on soil having a useable soil water reservoir ofat least 200 mm (1) . However, if no rainfall occurs, a lightirrigation about 1 month after water cutoff may be advantageous.The major difference between these two areas (Arizona-Californiaand Idaho) is that in Arizona and California, potential evapotranspirationrates are higher and increasing when fall-plantedbeets are harvested; whereas in Idaho, potential rates are lowerand decreasing when spring-planted beets are harvested. Allowingmid- to late-season water stress to develop in the Idaho areareduces irrigation water requirements by about 30% during August,September, and October when irrigation water and hydro-electricpower for pumping are in shortest supply. Other recent investigationsalso show the drought tolerance of sugarbeets throughoutthe growing season ( 8, 11)."Urban Agriculture and Community Development,,,,,"""Climate Change Adaptation in Agriculture || This topic explores various studies on how climate change impacts agriculture across different regions, including Nepal, Ethiopia, Ghana, Bangladesh, Pakistan, and Zimbabwe. It focuses on farmers' perceptions, adaptation strategies to mitigate adverse effects on crop yields and food security, and the economic implications of climate change on farming communities. The studies assess local practices, socio-economic factors influencing adaptation, and the overall vulnerability of agriculture to changing climate conditions, emphasizing the importance of tailored strategies to sustain agricultural productivity.""","Role of Homegarden Agroforestry Practice in Climate Change Adaptation in Aleta Chuko Woreda, Sidama Region, Southern Ethiopia","Indeed, the adverse effects of climate change are already evident in resource poor countries including Ethiopia.Southern Ethiopia is known with favorable environment for homegarden agroforestry (HGAF) Production practices.This study aimed at examining the role of HGAF practice in climate change adaptation in Aleta Chuko woreda, Southern Ethiopia.Multistage sampling procedures have used to select sample households.Data were collected from adopter and non-adopter categories of HGAF practice with similar socioeconomic background.A total of 141 households (68 adopters and 73 nonadopter) were involved in the household survey.The result revealed about 95% of the respondents observed the change in rainfall in the past three decades, whether decrease, late-onset or early cessation.While 87.3% of respondents perceived an increase in temperature.Farmers' adaptation strategies to climate change in the area context were soil and water conservation, application of inorganic fertilizer, use of small-scale irrigation and improved crop type were the tactical responses to climate change adaptation in the two adoption categories.It revealed that adoption of HGAF practice exhibit significance difference in terms of adaptation of climate change and sustaining of food security among the two adoption categories.From the result of analysis, access to credit and extension service, educational status, family size and membership of cooperative group shows statistically significant association in adoption of HGAF practices.The study concludes that policies that prioritize interventions to maximize the opportunities for climate change adaptation through HGAF system should been established in the context of the area."Plant Pathology and Resistance to Fungal Diseases,,,,,"Bean Cultivation & Water Efficiency || This topic encompasses research focused on the cultivation of Phaseolus vulgaris (common and snap beans) with a specific emphasis on pod quality, irrigation methods, nitrogen and phosphorus fertilization, and the effects of environmental conditions. Studies cover various agronomic practices aimed at optimizing yield, water use efficiency, and nutrient management in bean farming across different regions, including Ethiopia, Egypt, and Iran, under conditions of water scarcity and soil fertility challenges.",EFFECT OF SPRINKLER IRRIGATION AND COOLING ON YIELD AND QUALITY OF SNAP BEANS,"High temperatures and dry soil conditions that frequently occur in southern Alberta during July and August may cause objectionably high fiber content of snap beans (Phaseolus vulgaris L.). During the period 1968–71, the response of bean yield and quality to cooling by low-volume sprinkler irrigation during hot weather at the time of pod development was studied. Low-volume sprinkling for cooling prevented undesirable fiber formation and alleviated, to some extent, soil moisture stress. Where soil moisture was returned to field capacity by irrigation at 7- to 10-day intervals, yield and quality also remained high without low-volume sprinkler cooling. Thus, under Alberta conditions, excess fiber formation appears to be closely related to the amount of available soil moisture and can be avoided by proper irrigation with conventional methods."